{
  "feature_name": "USER-AUTH",
  "documentation_timestamp": "2025-12-19T10:30:00Z",
  "phase3_source": "results/USER-AUTH/phase3/ruletable.json",

  "business_processes": [
    {
      "process_id": "BP-AUTH-001",
      "process_name": "User Authentication and Session Lifecycle",
      "process_description": "Complete workflow for user login, session creation, and session management. Ensures only authorized users access the system while maintaining seamless user experience through persistent sessions.",

      "process_steps": [
        {
          "step_number": 1,
          "step_name": "User Credential Validation",
          "step_description": "System validates username and password against stored credentials. Failed attempts are tracked to prevent brute-force attacks.",
          "rules_applied": ["AUTH-BR-001", "AUTH-BR-002", "AUTH-BR-003"],
          "business_rationale": "Ensures only authorized users access the system and protects against automated password guessing attacks",
          "stakeholder_value": "Protects customer data and prevents unauthorized access while allowing legitimate users to authenticate",
          "decision_points": [
            {
              "condition": "If password is valid",
              "true_path": "Proceed to session creation (Step 2)",
              "false_path": "Increment failed attempt counter, return error to user"
            },
            {
              "condition": "If failed attempts >= 5",
              "true_path": "Lock account for 15 minutes (AUTH-BR-001), notify user",
              "false_path": "Allow retry with error message"
            }
          ]
        },
        {
          "step_number": 2,
          "step_name": "Session Token Creation",
          "step_description": "Upon successful validation, system creates secure session token with expiration time and stores in session database",
          "rules_applied": ["AUTH-BR-010"],
          "business_rationale": "Enables stateful user interactions without re-authentication for each request",
          "stakeholder_value": "Improves user experience through persistent login sessions while maintaining security"
        },
        {
          "step_number": 3,
          "step_name": "Session Lifecycle Management",
          "step_description": "System monitors session validity, handles timeouts (30 minutes inactivity), and manages session renewal",
          "rules_applied": ["AUTH-BR-011"],
          "business_rationale": "Balances security (automatic logout of inactive sessions) with usability (session renewal on activity)",
          "stakeholder_value": "Protects inactive sessions from unauthorized use while minimizing user re-authentication burden"
        }
      ],

      "total_rules": 5,
      "process_owner": "IT Security Department and Authentication Services Team",
      "process_priority": "Critical",
      "regulatory_compliance": ["NIST SP 800-63B", "SOC 2 Access Control"],

      "dependencies": {
        "upstream_processes": [],
        "downstream_processes": ["BP-PROFILE-001", "BP-AUTHORIZATION-001"]
      }
    },
    {
      "process_id": "BP-PASSWORD-001",
      "process_name": "Password Management and Validation",
      "process_description": "Workflow for password policy enforcement, password validation, hashing, and secure storage",

      "process_steps": [
        {
          "step_number": 1,
          "step_name": "Password Complexity Validation",
          "step_description": "System validates password meets minimum complexity requirements (8+ characters, uppercase, lowercase, number, special character)",
          "rules_applied": ["AUTH-BR-005"],
          "business_rationale": "Enforces strong password policy to prevent easy-to-guess passwords",
          "stakeholder_value": "Protects customer accounts from unauthorized access due to weak passwords"
        },
        {
          "step_number": 2,
          "step_name": "Password Hashing and Storage",
          "step_description": "System hashes password using bcrypt algorithm before storing in database. Original password never stored in plaintext.",
          "rules_applied": ["AUTH-BR-006"],
          "business_rationale": "Protects passwords even if database is compromised",
          "stakeholder_value": "Ensures customer credentials remain secure even in breach scenarios"
        }
      ],

      "total_rules": 2,
      "process_owner": "IT Security Department",
      "process_priority": "Critical",
      "regulatory_compliance": ["NIST SP 800-63B", "GDPR Data Protection"],

      "dependencies": {
        "upstream_processes": ["BP-REGISTRATION-001"],
        "downstream_processes": ["BP-AUTH-001"]
      }
    },
    {
      "process_id": "BP-PROFILE-001",
      "process_name": "User Profile Loading",
      "process_description": "Workflow for loading user profile data after successful authentication",

      "process_steps": [
        {
          "step_number": 1,
          "step_name": "Profile Data Retrieval",
          "step_description": "System retrieves user profile data (name, email, preferences) from database using authenticated user ID",
          "rules_applied": ["AUTH-BR-020"],
          "business_rationale": "Provides personalized user experience based on user-specific data",
          "stakeholder_value": "Enables customized interface and user-specific features"
        }
      ],

      "total_rules": 1,
      "process_owner": "User Experience Team",
      "process_priority": "High",
      "regulatory_compliance": ["GDPR Data Access"],

      "dependencies": {
        "upstream_processes": ["BP-AUTH-001"],
        "downstream_processes": []
      }
    }
  ],

  "process_flow_sequence": [
    "BP-PASSWORD-001",
    "BP-AUTH-001",
    "BP-PROFILE-001"
  ],

  "process_dependencies": [
    {
      "source_process": "BP-PASSWORD-001",
      "source_process_name": "Password Management and Validation",
      "target_process": "BP-AUTH-001",
      "target_process_name": "User Authentication and Session Lifecycle",
      "dependency_type": "Sequential",
      "dependency_description": "Password must be validated and hashed before authentication can verify it",
      "business_rationale": "Password validation ensures only compliant passwords are accepted, authentication verifies them"
    },
    {
      "source_process": "BP-AUTH-001",
      "source_process_name": "User Authentication and Session Lifecycle",
      "target_process": "BP-PROFILE-001",
      "target_process_name": "User Profile Loading",
      "dependency_type": "Sequential",
      "dependency_description": "User profile loads after session is established",
      "business_rationale": "Valid session required to access user-specific data and prevent unauthorized profile access"
    }
  ],

  "summary": {
    "total_processes": 3,
    "critical_processes": 2,
    "high_priority_processes": 1,
    "medium_priority_processes": 0,
    "low_priority_processes": 0,
    "total_process_steps": 6,
    "total_rules_mapped": 8,
    "total_dependencies": 2
  }
}
